{
  "$schema": "https://json-schema.org/draft/2020-12/schema",
  "$id": "https://chson.dev/schema/v2/chson.schema.json",
  "title": "ChSON Document",
  "description": "A structured format for knowledge fragments based on cognitive science principles of retrieval and chunking. Supports cheatsheets, checklists, runbooks, TLDRs, bookmarks, and more.",
  "type": "object",
  "additionalProperties": true,
  "required": ["title", "publicationDate", "description", "sections"],
  "properties": {
    "$schema": {
      "type": "string",
      "description": "JSON Schema reference URL."
    },
    "title": {
      "type": "string",
      "minLength": 1,
      "description": "The name of this document."
    },
    "version": {
      "type": "string",
      "minLength": 1,
      "description": "Version of the subject matter this document covers."
    },
    "publicationDate": {
      "type": "string",
      "anyOf": [
        { "format": "date" },
        { "format": "date-time" }
      ],
      "description": "When this document was published or last updated."
    },
    "description": {
      "type": "string",
      "minLength": 1,
      "description": "A brief summary of what this document covers."
    },
    "documentType": {
      "type": "string",
      "enum": ["cheatsheet", "checklist", "runbook", "tldr", "bookmarks"],
      "description": "The type of document, which may influence rendering. 'cheatsheet': quick reference for commands/shortcuts. 'checklist': ordered tasks to complete. 'runbook': step-by-step operational procedures. 'tldr': brief summaries of topics. 'bookmarks': curated link collections."
    },
    "author": {
      "type": "string",
      "description": "The author or maintainer of this document."
    },
    "license": {
      "type": "string",
      "description": "License identifier for this document (e.g., 'MIT', 'CC-BY-4.0')."
    },
    "homepage": {
      "type": "string",
      "format": "uri",
      "description": "URL of the official website or documentation for the subject matter."
    },
    "icon": {
      "type": "string",
      "description": "URL or relative path to an image representing this document (logo, icon, etc.)."
    },
    "tags": {
      "type": "array",
      "items": { "type": "string" },
      "description": "Keywords for categorization and discovery."
    },
    "retrievalDirection": {
      "type": "string",
      "enum": ["intent-to-mechanism", "mechanism-to-meaning"],
      "description": "Optional hint for renderers about the cognitive lookup direction. 'intent-to-mechanism': user knows what they want to do, needs the command/shortcut. 'mechanism-to-meaning': user sees a command/syntax, needs to understand what it does."
    },
    "anchorLabel": {
      "type": "string",
      "description": "Display name for the anchor column (default: 'Anchor'). Use 'Example' for code samples, 'Shortcut' for keyboard shortcuts, etc."
    },
    "contentLabel": {
      "type": "string",
      "description": "Display name for the content column (default: 'Content'). Use 'Description' for explanations, 'Action' for intent-based lookups, etc."
    },
    "metadata": {
      "type": "object",
      "additionalProperties": true,
      "description": "Additional freeform metadata (category, source, etc.)."
    },
    "sections": {
      "type": "array",
      "minItems": 1,
      "items": { "$ref": "#/$defs/section" },
      "description": "Logical groupings of related entries (chunks)."
    }
  },
  "$defs": {
    "section": {
      "type": "object",
      "additionalProperties": true,
      "required": ["title", "entries"],
      "properties": {
        "title": {
          "type": "string",
          "minLength": 1,
          "description": "The name of this section (chunk category)."
        },
        "description": {
          "type": "string",
          "description": "Optional explanation of what this section covers."
        },
        "entries": {
          "type": "array",
          "minItems": 1,
          "items": { "$ref": "#/$defs/entry" },
          "description": "The anchor-content pairs in this section."
        }
      }
    },
    "entry": {
      "type": "object",
      "additionalProperties": true,
      "required": ["anchor", "content"],
      "properties": {
        "anchor": {
          "type": "string",
          "minLength": 1,
          "description": "The retrieval anchor: what users scan for. Typically a command, shortcut, or action name."
        },
        "content": {
          "type": "string",
          "minLength": 1,
          "description": "The associated content: what users need to know once they find the anchor."
        },
        "details": {
          "type": "string",
          "description": "Extended explanation beyond the brief content. Typically interpreted as markdown by renderers."
        },
        "url": {
          "type": "string",
          "format": "uri",
          "description": "Reference link to learn more about this entry."
        },
        "comments": {
          "description": "Optional notes, warnings, or additional context."
        }
      }
    }
  }
}
